>>> import socket
>>> socket.gethostbyname('www.python.org')
'82.94.164.162'


21:52:37.302028 IP 192.168.0.9.44992 > 192.168.0.1.53: 27463+ A? www.python.org. (32)
21:52:37.312031 IP 192.168.0.1.53 > 192.168.0.9.44992: 27463 1/0/0 A 82.94.164.162 (48)


 python /usr/lib/python2.6/urllib.py -t http://www.python.org >/dev/null 2>&1

 21:53:44.118314 IP 192.168.0.9.40669 > 192.168.0.1.53: 32354+ A? www.python.org. (32)
21:53:44.118647 IP 192.168.0.9.40669 > 192.168.0.1.53: 50414+ AAAA? www.python.org. (32)
21:53:44.122547 IP 192.168.0.1.53 > 192.168.0.9.40669: 32354 1/0/0 A 82.94.164.162 (48)
21:53:44.135215 IP 192.168.0.1.53 > 192.168.0.9.40669: 50414 1/0/0 AAAA[|domain]

